{
  "$schema": "../../schema/course.schema.json",
  "id": "ME2171",
  "code": "ME2171",
  "name": "Cô ng nghệ may mặc",
  "nameEn": "Gar ment",
  "credits": 3,
  "faculty": "fme",
  "aliases": [],
  "status": "active",
  "programs": [
    {
      "program": "FME_KY_THUAT_DET_2022",
      "block": "K09",
      "required": true
    },
    {
      "program": "FME_KY_THUAT_DET_2023",
      "block": "K09",
      "required": true
    }
  ],
  "parts": [
    "theory"
  ],
  "related": [],
  "note": "Nhập từ nguồn công khai (truy cập 03/10/2026).",
  "updated": "2026-10-04"
}
