{
  "$schema": "../../schema/course.schema.json",
  "id": "ME4011",
  "code": "ME4011",
  "name": "Máy thi công cơ giới",
  "nameEn": "Construstion Equipment and Methods",
  "credits": 3,
  "faculty": "fme",
  "aliases": [],
  "status": "active",
  "programs": [],
  "parts": [
    "theory"
  ],
  "related": [],
  "note": "Nhập từ nguồn công khai (truy cập 03/10/2026).",
  "updated": "2026-10-04"
}
