{
  "$schema": "../../schema/course.schema.json",
  "id": "ME2161",
  "code": "ME2161",
  "name": "Truyền nhiệt và thiết bị trao đổi nhiệt",
  "nameEn": "Heat Transfer and Heat Exchangers",
  "credits": 3,
  "faculty": "fme",
  "aliases": [],
  "status": "active",
  "programs": [
    {
      "program": "FME_KY_THUAT_NHIET_2022",
      "block": "K09",
      "required": true
    },
    {
      "program": "FME_KY_THUAT_NHIET_2024",
      "block": "K12",
      "required": true
    },
    {
      "program": "FME_KY_THUAT_NHIET_2023",
      "block": "K09",
      "required": true
    }
  ],
  "parts": [
    "theory"
  ],
  "related": [],
  "note": "Nhập từ nguồn công khai (truy cập 03/10/2026).",
  "updated": "2026-10-04"
}
