{
  "$schema": "../../schema/course.schema.json",
  "id": "EE2057",
  "code": "EE2057",
  "name": "Đồ án 1 (KT Điện tử- Viễn thông & Kỹ thuật điện)",
  "nameEn": "Project 1",
  "credits": 1,
  "faculty": "dee",
  "aliases": [],
  "status": "active",
  "programs": [
    {
      "program": "DEE_SONG_NGANH_KY_THUAT_DIEN_TU_VIEN_THONG_KY_THUAT_DIEN_2020",
      "block": "K02",
      "required": true
    },
    {
      "program": "DEE_SONG_NGANH_KY_THUAT_DIEN_TU_VIEN_THONG_KY_THUAT_DIEN_2021",
      "block": "K11",
      "required": true
    },
    {
      "program": "DEE_SONG_NGANH_KY_THUAT_DIEN_TU_VIEN_THONG_KY_THUAT_DIEN_2022",
      "block": "K11",
      "required": true
    },
    {
      "program": "DEE_SONG_NGANH_KY_THUAT_DIEN_TU_VIEN_THONG_KY_THUAT_DIEN_2019",
      "block": "K02",
      "required": true
    }
  ],
  "parts": [
    "project"
  ],
  "related": [],
  "note": "Nhập từ nguồn công khai (truy cập 03/10/2026).",
  "updated": "2026-10-04"
}
