{
  "$schema": "../../schema/course.schema.json",
  "id": "GE4011",
  "code": "GE4011",
  "name": "Công nghệ xử lí dầu khí",
  "credits": 3,
  "faculty": "geopet",
  "aliases": [],
  "status": "retired",
  "replacedBy": "GE3167",
  "programs": [],
  "parts": [
    "theory"
  ],
  "related": [],
  "note": "Nhập từ nguồn công khai (truy cập 03/10/2026).",
  "updated": "2026-10-04"
}
