{
  "$schema": "../../schema/course.schema.json",
  "id": "GE3019",
  "code": "GE3019",
  "name": "Công trình xây dựng",
  "credits": 2,
  "faculty": "geopet",
  "aliases": [],
  "status": "retired",
  "replacedBy": "GE3137",
  "programs": [],
  "parts": [
    "theory"
  ],
  "related": [],
  "note": "Nhập từ nguồn công khai (truy cập 03/10/2026).",
  "updated": "2026-10-04"
}
