{
  "$schema": "../../schema/course.schema.json",
  "id": "ME2143",
  "code": "ME2143",
  "name": "Thực tập đại cương",
  "nameEn": "Professional Practice - Field Trips in Industrial Systems",
  "credits": 2,
  "faculty": "fme",
  "aliases": [],
  "status": "active",
  "programs": [
    {
      "program": "FME_LOGISTICS_VA_QUAN_LY_CHUOI_CUNG_UNG_2024",
      "block": "K12",
      "required": true
    },
    {
      "program": "FME_KY_THUAT_HE_THONG_CONG_NGHIEP_2024",
      "block": "K12",
      "required": true
    },
    {
      "program": "FME_KY_THUAT_HE_THONG_CONG_NGHIEP_2023",
      "block": "K10",
      "required": true
    },
    {
      "program": "FME_KY_THUAT_HE_THONG_CONG_NGHIEP_2022",
      "block": "K10",
      "required": true
    },
    {
      "program": "FME_LOGISTICS_VA_QUAN_LY_CHUOI_CUNG_UNG_2023",
      "block": "K10",
      "required": true
    },
    {
      "program": "FME_LOGISTICS_VA_QUAN_LY_CHUOI_CUNG_UNG_2022",
      "block": "K10",
      "required": true
    }
  ],
  "parts": [
    "lab"
  ],
  "related": [],
  "note": "Nhập từ nguồn công khai (truy cập 03/10/2026).",
  "updated": "2026-10-04"
}
