{
  "$schema": "../../schema/course.schema.json",
  "id": "ME4303",
  "code": "ME4303",
  "name": "Kỹ thuật cháy",
  "nameEn": "Combustion Engineering",
  "credits": 3,
  "faculty": "fme",
  "aliases": [],
  "status": "active",
  "programs": [
    {
      "program": "FME_KY_THUAT_NHIET_2024",
      "block": "K19",
      "required": true
    }
  ],
  "parts": [
    "theory"
  ],
  "related": [],
  "note": "Nhập từ nguồn công khai (truy cập 03/10/2026).",
  "updated": "2026-10-04"
}
