{
  "$schema": "../../schema/course.schema.json",
  "id": "ME4413",
  "code": "ME4413",
  "name": "Kết cấu thép thiết bị nâng",
  "nameEn": "Crane Steel Structure",
  "credits": 3,
  "faculty": "fme",
  "aliases": [],
  "status": "active",
  "programs": [],
  "parts": [
    "theory"
  ],
  "related": [],
  "note": "Nhập từ nguồn công khai (truy cập 03/10/2026).",
  "updated": "2026-10-04"
}
