{
  "$schema": "../../schema/course.schema.json",
  "id": "EE3091",
  "code": "EE3091",
  "name": "Vật liệu kỹ thuật điện",
  "nameEn": "Electrical Engineering Materials",
  "credits": 3,
  "faculty": "dee",
  "aliases": [],
  "status": "active",
  "programs": [
    {
      "program": "DEE_SONG_NGANH_KY_THUAT_DIEN_KY_THUAT_DIEN_TU_VIEN_THONG_2022",
      "block": "K13",
      "required": false
    },
    {
      "program": "DEE_SONG_NGANH_KY_THUAT_DIEN_KY_THUAT_DIEN_TU_VIEN_THONG_2023",
      "block": "K13",
      "required": false
    },
    {
      "program": "DEE_SONG_NGANH_KY_THUAT_DIEN_TU_VIEN_THONG_KY_THUAT_DIEN_2020",
      "block": "K07",
      "required": false
    },
    {
      "program": "DEE_SONG_NGANH_KY_THUAT_DIEN_TU_VIEN_THONG_KY_THUAT_DIEN_2021",
      "block": "K15",
      "required": false
    },
    {
      "program": "DEE_SONG_NGANH_KY_THUAT_DIEN_TU_VIEN_THONG_KY_THUAT_DIEN_2022",
      "block": "K15",
      "required": false
    },
    {
      "program": "DEE_SONG_NGANH_KY_THUAT_DIEN_TU_VIEN_THONG_KY_THUAT_DIEN_2019",
      "block": "K07",
      "required": false
    },
    {
      "program": "DEE_KY_THUAT_DIEN_2019",
      "block": "K03",
      "required": false
    },
    {
      "program": "DEE_KY_THUAT_DIEN_2020",
      "block": "K04",
      "required": false
    },
    {
      "program": "DEE_KY_THUAT_DIEN_2021",
      "block": "K12",
      "required": false
    },
    {
      "program": "DEE_KY_THUAT_DIEN_2022",
      "block": "K12",
      "required": false
    },
    {
      "program": "DEE_KY_THUAT_DIEN_2023",
      "block": "K12",
      "required": false
    },
    {
      "program": "DEE_KY_THUAT_DIEN_2024",
      "block": "K08",
      "required": false
    },
    {
      "program": "DEE_KY_THUAT_DIEN_2019_MYBK_SEED",
      "block": "K11",
      "required": false
    }
  ],
  "parts": [
    "theory"
  ],
  "related": [],
  "note": "Nhập từ nguồn công khai (truy cập 03/10/2026).",
  "updated": "2026-10-04"
}
